{
  "meta": {
    "product": "LuxSync Intelligent Living Concierge",
    "entry_point": "Find My LuxSync Solution",
    "output_name": "My LuxSync Blueprint",
    "brand_theme": "Intelligent Luxury",
    "brand_promise": "Where Luxury Lives Intelligently",
    "config_version": "1.0.0",
    "schema_version": "1.0.0",
    "rules_engine": "deterministic_weighted",
    "default_locale": "en-US"
  },
  "constants": {
    "priority_multipliers": {
      "priority_1": 1.5,
      "priority_2": 1.3,
      "priority_3": 1.15
    },
    "recommendation_thresholds": {
      "primary": 15,
      "strong": 10,
      "optional": 6,
      "suppress_below": 1
    },
    "minimum_recommended_experiences": 3,
    "minimum_profile_completeness_for_blueprint": 70,
    "square_footage_bands": [
      {
        "id": "lt_1000",
        "min": 0,
        "max": 999
      },
      {
        "id": "1000_1999",
        "min": 1000,
        "max": 1999
      },
      {
        "id": "2000_2999",
        "min": 2000,
        "max": 2999
      },
      {
        "id": "3000_4999",
        "min": 3000,
        "max": 4999
      },
      {
        "id": "5000_plus",
        "min": 5000,
        "max": null
      },
      {
        "id": "unknown",
        "min": null,
        "max": null
      }
    ]
  },
  "experience_catalog": [
    {
      "id": "welcome_home",
      "name": "Welcome Home",
      "category": "routine"
    },
    {
      "id": "effortless_departure",
      "name": "Effortless Departure",
      "category": "routine"
    },
    {
      "id": "goodnight",
      "name": "Goodnight",
      "category": "routine"
    },
    {
      "id": "gentle_morning",
      "name": "Gentle Morning",
      "category": "routine"
    },
    {
      "id": "intelligent_evening",
      "name": "Intelligent Evening",
      "category": "ambience"
    },
    {
      "id": "cinema",
      "name": "Cinema",
      "category": "entertainment"
    },
    {
      "id": "entertain",
      "name": "Entertain",
      "category": "entertainment"
    },
    {
      "id": "relax",
      "name": "Relax",
      "category": "ambience"
    },
    {
      "id": "away",
      "name": "Away",
      "category": "property_state"
    },
    {
      "id": "protect",
      "name": "Protect",
      "category": "property_awareness"
    },
    {
      "id": "water_watch",
      "name": "Water Watch",
      "category": "property_awareness"
    },
    {
      "id": "climate_intelligence",
      "name": "Climate Intelligence",
      "category": "comfort"
    },
    {
      "id": "energy_intelligence",
      "name": "Energy Intelligence",
      "category": "efficiency"
    },
    {
      "id": "night_path",
      "name": "Night Path",
      "category": "lighting"
    },
    {
      "id": "guest_ready",
      "name": "Guest Ready",
      "category": "str"
    },
    {
      "id": "turnover",
      "name": "Turnover",
      "category": "str"
    },
    {
      "id": "property_pulse",
      "name": "Property Pulse",
      "category": "property_awareness"
    },
    {
      "id": "accessible_living",
      "name": "Accessible Living",
      "category": "accessibility"
    },
    {
      "id": "vacation_mode",
      "name": "Vacation Mode",
      "category": "property_state"
    }
  ],
  "questionnaire": [
    {
      "stage_id": "welcome",
      "stage_label": "Welcome",
      "progress_label": "Beginning Your Blueprint",
      "questions": [
        {
          "id": "entry_action",
          "type": "single_select",
          "required": true,
          "prompt": "Let’s design how your space lives.",
          "options": [
            {
              "value": "begin_blueprint",
              "label": "Begin My Blueprint"
            },
            {
              "value": "know_what_i_need",
              "label": "I Already Know What I Need"
            }
          ]
        }
      ]
    },
    {
      "stage_id": "intent",
      "stage_label": "Intent",
      "progress_label": "Understanding Your Goals",
      "questions": [
        {
          "id": "primary_intent",
          "type": "single_select",
          "required": true,
          "prompt": "What brought you to LuxSync today?",
          "options": [
            {
              "value": "new_smart_home",
              "label": "I want to make my home smarter"
            },
            {
              "value": "optimize_existing",
              "label": "I already have smart devices but want them to work better together"
            },
            {
              "value": "product_guidance",
              "label": "I want help choosing products"
            },
            {
              "value": "str_automation",
              "label": "I want to automate a short-term rental"
            },
            {
              "value": "business_automation",
              "label": "I want to improve a business or office"
            },
            {
              "value": "solve_problem",
              "label": "I have a specific problem I want to solve"
            },
            {
              "value": "exploration",
              "label": "I want to see what is possible"
            }
          ]
        },
        {
          "id": "desired_outcomes",
          "type": "multi_select",
          "required": true,
          "prompt": "What would make your space feel more intelligent?",
          "options": [
            {
              "value": "convenience",
              "label": "Make everyday life easier",
              "tags": [
                "convenience"
              ],
              "base_weight": 3
            },
            {
              "value": "arrival",
              "label": "Make arriving home effortless",
              "tags": [
                "arrival"
              ],
              "base_weight": 3
            },
            {
              "value": "comfort",
              "label": "Improve comfort",
              "tags": [
                "comfort"
              ],
              "base_weight": 3
            },
            {
              "value": "awareness",
              "label": "Improve awareness and peace of mind",
              "tags": [
                "awareness"
              ],
              "base_weight": 3
            },
            {
              "value": "energy",
              "label": "Reduce unnecessary energy use",
              "tags": [
                "energy"
              ],
              "base_weight": 3
            },
            {
              "value": "entertainment",
              "label": "Create better entertainment experiences",
              "tags": [
                "entertainment"
              ],
              "base_weight": 3
            },
            {
              "value": "accessibility",
              "label": "Make spaces easier to use",
              "tags": [
                "accessibility"
              ],
              "base_weight": 3
            },
            {
              "value": "guest_experience",
              "label": "Improve guest experiences",
              "tags": [
                "guest_experience"
              ],
              "base_weight": 3
            },
            {
              "value": "remote_management",
              "label": "Manage property remotely",
              "tags": [
                "remote_management"
              ],
              "base_weight": 3
            },
            {
              "value": "integration",
              "label": "Help devices work together",
              "tags": [
                "integration"
              ],
              "base_weight": 3
            },
            {
              "value": "discovery",
              "label": "Surprise me",
              "tags": [
                "discovery"
              ],
              "base_weight": 2
            }
          ]
        }
      ]
    },
    {
      "stage_id": "property",
      "stage_label": "Property",
      "progress_label": "Understanding Your Space",
      "questions": [
        {
          "id": "property_type",
          "type": "single_select",
          "required": true,
          "prompt": "What type of space are we designing?",
          "options": [
            {
              "value": "private_residence",
              "label": "Private Residence"
            },
            {
              "value": "short_term_rental",
              "label": "Short-Term Rental"
            },
            {
              "value": "business",
              "label": "Business / Commercial"
            },
            {
              "value": "other",
              "label": "Other"
            }
          ]
        },
        {
          "id": "residence_type",
          "type": "single_select",
          "required": true,
          "show_when": {
            "property_type": [
              "private_residence"
            ]
          },
          "prompt": "What type of residence?",
          "options": [
            {
              "value": "single_family",
              "label": "Single-Family Home"
            },
            {
              "value": "townhome",
              "label": "Townhome"
            },
            {
              "value": "condominium",
              "label": "Condominium"
            },
            {
              "value": "apartment",
              "label": "Apartment"
            },
            {
              "value": "vacation_home",
              "label": "Vacation Home"
            },
            {
              "value": "new_construction",
              "label": "New Construction"
            },
            {
              "value": "other",
              "label": "Other"
            }
          ]
        },
        {
          "id": "str_property_type",
          "type": "single_select",
          "required": true,
          "show_when": {
            "property_type": [
              "short_term_rental"
            ]
          },
          "prompt": "Tell us about the rental property.",